Test data,${teams_group_name},${sensitivity_label},${sensitivity_label_no},${space_type},${space_type_no},${justification},${rejection_justification}
1,Public; Validator and L2 Apps Admin,Public,2,Validator and L2 Apps Admin,3,Automated testing,L2 Apps Admin rejects
2,Public; L2 Apps Admin and L2 IM,Public,2,L2 Apps Admin and L2 IM,2,Automated testing,L2 Apps Admin rejects
3,"Internal; Validator, L2 apps Admin and L2 IM",Internal,1,"Validator, L2 Aps Admin and L2 IM",4,Automated testing,L2 Apps Admin rejects
4,Internal; L2 Apps Admin,Internal,1,L2 Apps Admin,1,Automated testing,L2 Apps Admin rejects
5,Confidential; Validator and L2 Apps Admin,Confidential,0,Validator and L2 Apps Admin,3,Automated testing,L2 Apps Admin rejects
6,Confidential; L2 Apps Admin,Confidential,0,L2 Apps Admin,1,Automated testing,L2 Apps Admin rejects
7,"SC; Validator, L2 apps Admin and L2 IM",Strictly Confidential,3,"Validator, L2 Aps Admin and L2 IM",4,Automated testing,L2 Apps Admin rejects
8,"SC; L2 Apps Admin and L2 IM",Strictly Confidential,3,L2 Apps Admin and L2 IM,2,Automated testing,L2 Apps Admin rejects